CPU:
   vendor_id = "GenuineIntel"
   version information (1/eax):
      processor type  = primary processor (0)
      family          = 0x6 (6)
      model           = 0xa (10)
      stepping id     = 0x2 (2)
      extended family = 0x0 (0)
      extended model  = 0xb (11)
      (family synth)  = 0x6 (6)
      (model synth)   = 0xba (186)
   miscellaneous (1/ebx):
      process local APIC physical ID = 0x0 (0)
      maximum IDs for CPUs in pkg    = 0x1 (1)
      CLFLUSH line size              = 0x8 (8)
      brand index                    = 0x0 (0)
   brand id = 0x00 (0): unknown
   feature information (1/edx):
      x87 FPU on chip                        = true
      VME: virtual-8086 mode enhancement     = true
      DE: debugging extensions               = true
      PSE: page size extensions              = true
      TSC: time stamp counter                = true
      RDMSR and WRMSR support                = true
      PAE: physical address extensions       = true
      MCE: machine check exception           = true
      CMPXCHG8B inst.                        = true
      APIC on chip                           = true
      SYSENTER and SYSEXIT                   = true
      MTRR: memory type range registers      = true
      PTE global bit                         = true
      MCA: machine check architecture        = true
      CMOV: conditional move/compare instr   = true
      PAT: page attribute table              = true
      PSE-36: page size extension            = true
      PSN: processor serial number           = false
      CLFLUSH instruction                    = true
      DS: debug store                        = false
      ACPI: thermal monitor and clock ctrl   = false
      MMX Technology                         = true
      FXSAVE/FXRSTOR                         = true
      SSE extensions                         = true
      SSE2 extensions                        = true
      SS: self snoop                         = true
      hyper-threading / multi-core supported = false
      TM: therm. monitor                     = false
      IA64                                   = false
      PBE: pending break event               = false
   feature information (1/ecx):
      PNI/SSE3: Prescott New Instructions     = true
      PCLMULDQ instruction                    = true
      DTES64: 64-bit debug store              = false
      MONITOR/MWAIT                           = false
      CPL-qualified debug store               = false
      VMX: virtual machine extensions         = false
      SMX: safer mode extensions              = false
      Enhanced Intel SpeedStep Technology     = false
      TM2: thermal monitor 2                  = false
      SSSE3 extensions                        = true
      context ID: adaptive or shared L1 data  = false
      SDBG: IA32_DEBUG_INTERFACE              = false
      FMA instruction                         = true
      CMPXCHG16B instruction                  = true
      xTPR disable                            = false
      PDCM: perfmon and debug                 = false
      PCID: process context identifiers       = true
      DCA: direct cache access                = false
      SSE4.1 extensions                       = true
      SSE4.2 extensions                       = true
      x2APIC: extended xAPIC support          = true
      MOVBE instruction                       = true
      POPCNT instruction                      = true
      time stamp counter deadline             = false
      AES instruction                         = true
      XSAVE/XSTOR states                      = true
      OS-enabled XSAVE/XSTOR                  = true
      AVX: advanced vector extensions         = true
      F16C half-precision convert instruction = true
      RDRAND instruction                      = true
      hypervisor guest status                 = true
   cache and TLB information (2):
      0xff: cache data is in CPUID leaf 4
      0xfe: TLB data is in CPUID leaf 0x18
      0xf0: 64 byte prefetching
   processor serial number = 000B-06A2-0000-0000-0000-0000
   deterministic cache parameters (4):
      --- cache 0 ---
      cache type                         = data cache (1)
      cache level                        = 0x1 (1)
      self-initializing cache level      = true
      fully associative cache            = false
      maximum IDs for CPUs sharing cache = 0x0 (0)
      maximum IDs for cores in pkg       = 0x0 (0)
      system coherency line size         = 0x40 (64)
      physical line partitions           = 0x1 (1)
      ways of associativity              = 0xc (12)
      number of sets                     = 0x40 (64)
      WBINVD/INVD acts on lower caches   = false
      inclusive to lower caches          = false
      complex cache indexing             = false
      number of sets (s)                 = 64
      (size synth)                       = 49152 (48 KB)
      --- cache 1 ---
      cache type                         = instruction cache (2)
      cache level                        = 0x1 (1)
      self-initializing cache level      = true
      fully associative cache            = false
      maximum IDs for CPUs sharing cache = 0x0 (0)
      maximum IDs for cores in pkg       = 0x0 (0)
      system coherency line size         = 0x40 (64)
      physical line partitions           = 0x1 (1)
      ways of associativity              = 0x8 (8)
      number of sets                     = 0x40 (64)
      WBINVD/INVD acts on lower caches   = false
      inclusive to lower caches          = false
      complex cache indexing             = false
      number of sets (s)                 = 64
      (size synth)                       = 32768 (32 KB)
      --- cache 2 ---
      cache type                         = unified cache (3)
      cache level                        = 0x2 (2)
      self-initializing cache level      = true
      fully associative cache            = false
      maximum IDs for CPUs sharing cache = 0x0 (0)
      maximum IDs for cores in pkg       = 0x0 (0)
      system coherency line size         = 0x40 (64)
      physical line partitions           = 0x1 (1)
      ways of associativity              = 0xa (10)
      number of sets                     = 0x800 (2048)
      WBINVD/INVD acts on lower caches   = false
      inclusive to lower caches          = false
      complex cache indexing             = false
      number of sets (s)                 = 2048
      (size synth)                       = 1310720 (1.2 MB)
      --- cache 3 ---
      cache type                         = unified cache (3)
      cache level                        = 0x3 (3)
      self-initializing cache level      = true
      fully associative cache            = false
      maximum IDs for CPUs sharing cache = 0x0 (0)
      maximum IDs for cores in pkg       = 0x0 (0)
      system coherency line size         = 0x40 (64)
      physical line partitions           = 0x1 (1)
      ways of associativity              = 0xc (12)
      number of sets                     = 0x8000 (32768)
      WBINVD/INVD acts on lower caches   = false
      inclusive to lower caches          = false
      complex cache indexing             = true
      number of sets (s)                 = 32768
      (size synth)                       = 25165824 (24 MB)
      --- cache 4 ---
      cache type                         = no more caches (0)
   MONITOR/MWAIT (5):
      smallest monitor-line size (bytes)       = 0x0 (0)
      largest monitor-line size (bytes)        = 0x0 (0)
      enum of Monitor-MWAIT exts supported     = false
      supports intrs as break-event for MWAIT  = false
      monitorless MWAIT supported              = false
      number of C0 sub C-states using MWAIT    = 0x0 (0)
      number of C1 sub C-states using MWAIT    = 0x0 (0)
      number of C2 sub C-states using MWAIT    = 0x0 (0)
      number of C3 sub C-states using MWAIT    = 0x0 (0)
      number of C4 sub C-states using MWAIT    = 0x0 (0)
      number of C5 sub C-states using MWAIT    = 0x0 (0)
      number of C6 sub C-states using MWAIT    = 0x0 (0)
      number of C7 sub C-states using MWAIT    = 0x0 (0)
   Thermal and Power Management Features (6):
      digital thermometer                     = false
      Intel Turbo Boost Technology            = false
      ARAT always running APIC timer          = true
      PLN power limit notification            = false
      ECMD extended clock modulation duty     = false
      PTM package thermal management          = false
      HWP base registers                      = false
      HWP notification                        = false
      HWP activity window                     = false
      HWP energy performance preference       = false
      HWP package level request               = false
      HDC base registers                      = false
      Intel Turbo Boost Max Technology 3.0    = false
      HWP capabilities                        = false
      HWP PECI override                       = false
      flexible HWP                            = false
      IA32_HWP_REQUEST MSR fast access mode   = false
      HW_FEEDBACK MSRs supported              = false
      ignoring idle logical processor HWP req = false
      IA32_HWP_CTL MSR supported              = false
      Thread Director                         = false
      IA32_HW_FEEDBACK_THREAD_CONFIG bit 25   = false
      digital thermometer thresholds          = 0x0 (0)
      hardware coordination feedback          = false
      ACNT2 available                         = false
      performance-energy bias capability      = false
      number of enh hardware feedback classes = 0x0 (0)
      performance capability reporting        = false
      energy efficiency capability reporting  = false
      size of feedback struct (4KB pages)     = 0x1 (1)
      index of CPU's row in feedback struct   = 0x0 (0)
   extended feature flags (7):
      FSGSBASE instructions                    = true
      IA32_TSC_ADJUST MSR supported            = true
      SGX: Software Guard Extensions supported = false
      BMI1 instructions                        = true
      HLE hardware lock elision                = false
      AVX2: advanced vector extensions 2       = true
      FDP_EXCPTN_ONLY                          = false
      SMEP supervisor mode exec protection     = true
      BMI2 instructions                        = true
      enhanced REP MOVSB/STOSB                 = true
      INVPCID instruction                      = true
      RTM: restricted transactional memory     = false
      RDT-CMT/PQoS cache monitoring            = false
      deprecated FPU CS/DS                     = true
      MPX: intel memory protection extensions  = false
      RDT-CAT/PQE cache allocation             = false
      AVX512F: AVX-512 foundation instructions = false
      AVX512DQ: double & quadword instructions = false
      RDSEED instruction                       = true
      ADX instructions                         = true
      SMAP: supervisor mode access prevention  = true
      AVX512IFMA: integer fused multiply add   = false
      PCOMMIT instruction                      = false
      CLFLUSHOPT instruction                   = true
      CLWB instruction                         = true
      Intel processor trace                    = false
      AVX512PF: prefetch instructions          = false
      AVX512ER: exponent & reciprocal instrs   = false
      AVX512CD: conflict detection instrs      = false
      SHA instructions                         = true
      AVX512BW: byte & word instructions       = false
      AVX512VL: vector length                  = false
      PREFETCHWT1                              = false
      AVX512VBMI: vector byte manipulation     = false
      UMIP: user-mode instruction prevention   = true
      PKU protection keys for user-mode        = false
      OSPKE CR4.PKE and RDPKRU/WRPKRU          = false
      WAITPKG instructions                     = false
      AVX512_VBMI2: byte VPCOMPRESS, VPEXPAND  = false
      CET_SS: CET shadow stack                 = false
      GFNI: Galois Field New Instructions      = true
      VAES instructions                        = true
      VPCLMULQDQ instruction                   = true
      AVX512_VNNI: neural network instructions = false
      AVX512_BITALG: bit count/shiffle         = false
      TME: Total Memory Encryption             = false
      AVX512: VPOPCNTDQ instruction            = false
      LA57: 57-bit addrs & 5-level paging      = false
      BNDLDX/BNDSTX MAWAU value in 64-bit mode = 0x0 (0)
      RDPID: read processor ID supported       = true
      KL: key locker                           = false
      bus lock detection                       = false
      CLDEMOTE supports cache line demote      = false
      MOVDIRI instruction                      = true
      MOVDIR64B instruction                    = true
      ENQCMD instruction                       = false
      SGX_LC: SGX launch config supported      = false
      PKS: supervisor protection keys          = false
      SGX-KEYS: SGX attestation services       = false
      AVX512_4VNNIW: neural network instrs     = false
      AVX512_4FMAPS: multiply acc single prec  = false
      fast short REP MOV                       = true
      UINTR: user interrupts                   = false
      AVX512_VP2INTERSECT: intersect mask regs = false
      IA32_MCU_OPT_CTRL SRBDS mitigation MSR   = false
      VERW MD_CLEAR microcode support          = true
      RTM transaction always aborts            = false
      IA32_TSX_FORCE_ABORT MSR                 = false
      SERIALIZE instruction                    = true
      hybrid part                              = false
      TSXLDTRK: TSX suspend load addr tracking = false
      PCONFIG instruction                      = false
      LBR: architectural last branch records   = false
      CET_IBT: CET indirect branch tracking    = false
      AMX-BF16: tile bfloat16 support          = false
      AVX512_FP16: fp16 support                = false
      AMX-TILE: tile architecture support      = false
      AMX-INT8: tile 8-bit integer support     = false
      IBRS/IBPB: indirect branch restrictions  = true
      STIBP: 1 thr indirect branch predictor   = true
      L1D_FLUSH: IA32_FLUSH_CMD MSR            = true
      IA32_ARCH_CAPABILITIES MSR               = true
      IA32_CORE_CAPABILITIES MSR               = false
      SSBD: speculative store bypass disable   = true
      SHA512 instructions                      = false
      SM3 instructions                         = false
      SM4 instructions                         = false
      RAO-INT atomic instructions              = false
      AVX-VNNI: AVX VNNI neural network instrs = true
      AVX512_BF16: bfloat16 instructions       = false
      LASS: linear address space separation    = false
      CMPccXADD instructions                   = false
      ArchPerfmonExt leaf 0x23 is valid        = false
      fast zero-length REP MOVSB               = false
      fast short REP STOSB                     = true
      fast short REP CMPSB, REP SCASB          = false
      FRED transitions & MSRs                  = false
      LKGS instruction                         = false
      WRMSRNS instruction                      = false
      NMI-source reporting                     = false
      AMX-FP16: FP16 tile operations           = false
      HRESET: history reset support            = false
      AVX-IFMA: integer fused multiply add     = false
      LAM: linear address masking              = false
      RDMSRLIST, WRMSRLIST instructions        = false
      INVD prevention after BIOS done          = false
      MOVRS instructions                       = false
      IA32_PPIN & IA32_PPIN_CTL MSRs supported = false
      PBNDKB instruction                       = false
      IA32_MISC_ENABLE cannot limit CPUID max  = false
      RDMSR/WRMSRNS immediates supported       = false
      AVX-VNNI-INT8 instructions               = false
      AVX-NE-CONVERT instructions              = false
      AMX-COMPLEX instructions                 = false
      AVX-VNNI-INT16 instructions              = false
      user-timer events                        = false
      PREFETCHIT0, PREFETCHIT1 instructions    = false
      URDMSR, UWRMSR instructions              = false
      UIRET flexibly updates UIF               = false
      CET_SSS: shadow stacks w/o page faults   = false
      AVX10 instructions                       = false
      APX advanced performance extensions      = false
      MWAIT instruction                        = false
      PSFD: fast store forwarding pred disable = true
      IPRED_CTRL: IBP disable                  = false
      RRSBA_CTRL: IBP bottomless RSB disable   = false
      DDPD_U: data dep prefetcher disable      = false
      BHI_CTRL: IBP BHB-focused disable        = false
      MCDT_NO: MCDT mitigation not needed      = false
      UC-lock disable                          = false
      MONITOR perf unaffected by tbl overflow  = false
   Direct Cache Access Parameters (9):
      PLATFORM_DCA_CAP MSR bits = 0
   Architecture Performance Monitoring Features (0xa):
      version ID                               = 0x1 (1)
      number of counters per logical processor = 0x6 (6)
      bit width of counter                     = 0x30 (48)
      length of EBX bit vector                 = 0x7 (7)
      core cycle event                         = not available
      instruction retired event                = not available
      reference cycles event                   = not available
      last-level cache ref event               = not available
      last-level cache miss event              = not available
      branch inst retired event                = not available
      branch mispred retired event             = not available
      topdown slots event                      = not available
      topdown backend bound                    = not available
      topdown bad speculation                  = not available
      topdown frontend bound                   = not available
      topdown retiring                         = not available
      LBR inserts                              = not available
      fixed counter  0 supported               = true
      fixed counter  1 supported               = true
      fixed counter  2 supported               = true
      fixed counter  3 supported               = false
      fixed counter  4 supported               = false
      fixed counter  5 supported               = false
      fixed counter  6 supported               = false
      fixed counter  7 supported               = false
      fixed counter  8 supported               = false
      fixed counter  9 supported               = false
      fixed counter 10 supported               = false
      fixed counter 11 supported               = false
      fixed counter 12 supported               = false
      fixed counter 13 supported               = false
      fixed counter 14 supported               = false
      fixed counter 15 supported               = false
      fixed counter 16 supported               = false
      fixed counter 17 supported               = false
      fixed counter 18 supported               = false
      fixed counter 19 supported               = false
      fixed counter 20 supported               = false
      fixed counter 21 supported               = false
      fixed counter 22 supported               = false
      fixed counter 23 supported               = false
      fixed counter 24 supported               = false
      fixed counter 25 supported               = false
      fixed counter 26 supported               = false
      fixed counter 27 supported               = false
      fixed counter 28 supported               = false
      fixed counter 29 supported               = false
      fixed counter 30 supported               = false
      fixed counter 31 supported               = false
      number of contiguous fixed counters      = 0x0 (0)
      bit width of fixed counters              = 0x0 (0)
      anythread deprecation                    = true
   x2APIC features / processor topology (0xb):
      extended APIC ID                      = 0
      --- level 0 ---
      level number                          = 0x0 (0)
      level type                            = thread (1)
      bit width of level & previous levels  = 0x0 (0)
      number of logical processors at level = 0x1 (1)
      --- level 1 ---
      level number                          = 0x1 (1)
      level type                            = core (2)
      bit width of level & previous levels  = 0x0 (0)
      number of logical processors at level = 0x1 (1)
      --- level 2 ---
      level number                          = 0x2 (2)
      level type                            = invalid (0)
      bit width of level & previous levels  = 0x0 (0)
      number of logical processors at level = 0x0 (0)
   XSAVE features (0xd/0):
      XCR0 valid bit field mask               = 0x0000000000000007
         x87 state                            = true
         SSE state                            = true
         AVX state                            = true
         MPX BNDREGS                          = false
         MPX BNDCSR                           = false
         AVX-512 opmask                       = false
         AVX-512 ZMM_Hi256                    = false
         AVX-512 Hi16_ZMM                     = false
         PKRU state                           = false
         XTILECFG state                       = false
         XTILEDATA state                      = false
      bytes required by fields in XCR0        = 0x00000340 (832)
      bytes required by XSAVE/XRSTOR area     = 0x00000340 (832)
      XSAVEOPT instruction                    = true
      XSAVEC instruction                      = true
      XGETBV instruction                      = true
      XSAVES/XRSTORS instructions             = true
      XFD: extended feature disable supported = false
      SAVE area size in bytes                 = 0x00000340 (832)
      IA32_XSS valid bit field mask           = 0x0000000000000000
         PT state                             = false
         PASID state                          = false
         CET_U user state                     = false
         CET_S supervisor state               = false
         HDC state                            = false
         UINTR state                          = false
         LBR state                            = false
         HWP state                            = false
   AVX/YMM features (0xd/2):
      AVX/YMM save state byte size             = 0x00000100 (256)
      AVX/YMM save state byte offset           = 0x00000240 (576)
      supported in IA32_XSS or XCR0            = XCR0 (user state)
      64-byte alignment in compacted XSAVE     = false
      XFD faulting supported                   = false
   Quality of Service Monitoring Resource Type (0xf/0):
      Maximum range of RMID = 0
      supports L3 cache monitoring = false
   Resource Director Technology Allocation (0x10/0):
      L3 cache allocation technology supported = false
      L2 cache allocation technology supported = false
      memory bandwidth allocation supported    = false
      cache bandwidth allocation supported     = false
   0x00000011 0x00: eax=0x00000000 ebx=0x00000000 ecx=0x00000000 edx=0x00000000
   Software Guard Extensions (SGX) capability (0x12/0):
      SGX1 supported                           = false
      SGX2 supported                           = false
      SGX ENCLV E*VIRTCHILD, ESETCONTEXT       = false
      SGX ENCLS ETRACKC, ERDINFO, ELDBC, ELDUC = false
      SGX ENCLU EVERIFYREPORT2                 = false
      SGX ENCLS EUPDATESVN                     = false
      SGX ENCLU EDECCSSA                       = false
      MISCSELECT.EXINFO supported: #PF & #GP   = false
      MISCSELECT.CPINFO supported: #CP         = false
      MaxEnclaveSize_Not64 (log2)              = 0x0 (0)
      MaxEnclaveSize_64 (log2)                 = 0x0 (0)
   SGX attributes: ECREATE SECS.ATTRIBUTES (0x12/1):
      valid bit mask = 0x00000000000000000000000000000000
      enclave initialized by EINIT           = false
      enclave debugger read/write permission = false
      enclave 64-bit mode                    = false
      provisioning key available             = false
      EINIT token key available              = false
      CET attributes enabled                 = false
      KSS key separation & sharing enabled   = false
      AEX attribute enabled                  = false
      XFRM: XSAVE feature request mask       = 0x0000000000000000
         XCR0 supported: x87 state           = false
         XCR0 supported: SSE state           = false
         XCR0 supported: AVX state           = false
         XCR0 supported: MPX BNDREGS         = false
         XCR0 supported: MPX BNDCSR          = false
         XCR0 supported: AVX-512 opmask      = false
         XCR0 supported: AVX-512 ZMM_Hi256   = false
         XCR0 supported: AVX-512 Hi16_ZMM    = false
         IA32_XSS supported: PT state        = false
         XCR0 supported: PKRU state          = false
         XCR0 supported: CET_U state         = false
         XCR0 supported: CET_S state         = false
         IA32_XSS supported: HDC state       = false
         IA32_XSS supported: UINTR state     = false
         LBR supported                       = false
         IA32_XSS supported: HWP state       = false
         XTILECFG supported                  = false
         XTILEDATA supported                 = false
   SGX Enclave Page Cache (EPC) enumeration (0x12/0x2):
      type = invalid
   0x00000013 0x00: eax=0x00000000 ebx=0x00000000 ecx=0x00000000 edx=0x00000000
   Intel Processor Trace (0x14):
      IA32_RTIT_CR3_MATCH is accessible      = false
      configurable PSB & cycle-accurate      = false
      IP & TraceStop filtering; PT preserve  = false
      MTC timing packet; suppress COFI-based = false
      PTWRITE support                        = false
      power event trace support              = false
      PSB/PMI preservation support           = false
      IA32_RTIT_CTL EventEn enable supported = false
      IA32_RTIT_CTL DisTNT disable supported = false
      PTTT processor trace trigger tracing   = false
      ToPA output scheme support             = false
      ToPA can hold many output entries      = false
      single-range output scheme support     = false
      output to trace transport              = false
      IP payloads have LIP values & CS       = false
   Time Stamp Counter/Core Crystal Clock Information (0x15):
      TSC/clock ratio = 0/0
      nominal core crystal clock = 0 Hz
   Processor Frequency Information (0x16):
      Core Base Frequency (MHz) = 0x0 (0)
      Core Maximum Frequency (MHz) = 0x0 (0)
      Bus (Reference) Frequency (MHz) = 0x0 (0)
   System-On-Chip Vendor Attribute (0x17):
      vendor id     = 0x0 (0)
      vendor scheme = assigned by intel
      project id    = 0x00000000 (0)
      stepping id   = 0x00000000 (0)
   Deterministic Address Translation Parameters (0x18/0):
      4KB page size entries supported   = false
      2MB page size entries supported   = false
      4MB page size entries supported   = false
      1GB page size entries supported   = false
      partitioning                      = soft between logical processors
      ways of associativity             = 0x0 (0)
      number of sets                    = 0x00000000 (0)
      translation cache type            = invalid (0)
      translation cache level           = 0x1 (1)
      fully associative                 = false
      maximum number of addressible IDs = 0x1 (1)
   Key Locker information (0x19):
      CPL0-only restriction supported  = false
      no-encrypt restriction supported = false
      no-decrypt restriction supported = false
      AESKLE: AES instructions         = false
      AES wide instructions            = false
      MSRs & IWKEY backups             = false
      LOADIWKEY NoBackup parameter     = false
      IWKEY randomization supported    = false
   Native Model ID Information (0x1a/0):
      native model ID of core = 0x0 (0)
      core type               = 0x0 (0)
   PCONFIG information (0x1b/0x0):
      sub-leaf type = invalid (0)
   PCONFIG information (0x1b/0x1):
      sub-leaf type = invalid (0)
   Architectural LBR Capabilities (0x1c/0):
      IA32_LBR_DEPTH.DEPTH  8 supported = false
      IA32_LBR_DEPTH.DEPTH 16 supported = false
      IA32_LBR_DEPTH.DEPTH 24 supported = false
      IA32_LBR_DEPTH.DEPTH 32 supported = false
      IA32_LBR_DEPTH.DEPTH 40 supported = false
      IA32_LBR_DEPTH.DEPTH 48 supported = false
      IA32_LBR_DEPTH.DEPTH 56 supported = false
      IA32_LBR_DEPTH.DEPTH 64 supported = false
      deep C-state reset supported      = false
      LBR IP values contain             = EIP (0)
      CPL filtering supported           = false
      branch filtering supported        = false
      call-stack mode supported         = false
      mispredict bit supported          = false
      timed LBRs supported              = false
      branch type field supported       = false
      event logging supported bitmap    = 0x0 (0)
   Tile Information (0x1d):
      max_palette = 0
   TMUL Information (0x1e):
      tmul_maxk                                = 0x0 (0)
      tmul_maxn                                = 0x0 (0)
      AMX-INT8: tile 8-bit integer support     = false
      AMX-BF16: tile bfloat16 support          = false
      AMX-COMPLEX: tile AMX-COMPLEX instrs     = false
      AMX-FP16: tile FP16 support              = false
      AMX-FP8: tile FP8 support                = false
      AMX-TRANSPOSE: tile AMX-TRANSPOSE instrs = false
      AMX-TF32: tile TF32 (FP19) instrs        = false
      AMX-AVX512: tile AMX-AVX512 instrs       = false
      AMX-MOVRS: tile MOVRS instrs             = false
   V2 extended topology (0x1f):
      x2APIC ID of logical processor = 0x0 (0)
      --- level 0 ---
      level number                          = 0x0 (0)
      level type                            = thread (1)
      bit width of level & previous levels  = 0x0 (0)
      number of logical processors at level = 0x1 (1)
      --- level 1 ---
      level number                          = 0x1 (1)
      level type                            = core (2)
      bit width of level & previous levels  = 0x0 (0)
      number of logical processors at level = 0x1 (1)
      --- level 2 ---
      level number                          = 0x2 (2)
      level type                            = invalid (0)
      bit width of level & previous levels  = 0x0 (0)
      number of logical processors at level = 0x0 (0)
   Processor History Reset information (0x20):
      HRESET supported: EHFI history = false
   hypervisor_id (0x40000000) = "VMwareVMware"
   0x40000001 0x00: eax=0x00000000 ebx=0x00000000 ecx=0x00000000 edx=0x00000000
   0x40000002 0x00: eax=0x00000000 ebx=0x00000000 ecx=0x00000000 edx=0x00000000
   0x40000003 0x00: eax=0x00000000 ebx=0x00000000 ecx=0x00000000 edx=0x00000000
   0x40000004 0x00: eax=0x00000000 ebx=0x00000000 ecx=0x00000000 edx=0x00000000
   0x40000005 0x00: eax=0x00000000 ebx=0x00000000 ecx=0x00000000 edx=0x00000000
   0x40000006 0x00: eax=0x00000000 ebx=0x00000000 ecx=0x00000000 edx=0x00000000
   0x40000007 0x00: eax=0x00000000 ebx=0x00000000 ecx=0x00000000 edx=0x00000000
   0x40000008 0x00: eax=0x00000000 ebx=0x00000000 ecx=0x00000000 edx=0x00000000
   0x40000009 0x00: eax=0x00000000 ebx=0x00000000 ecx=0x00000000 edx=0x00000000
   0x4000000a 0x00: eax=0x00000000 ebx=0x00000000 ecx=0x00000000 edx=0x00000000
   0x4000000b 0x00: eax=0x00000000 ebx=0x00000000 ecx=0x00000000 edx=0x00000000
   0x4000000c 0x00: eax=0x00000000 ebx=0x00000000 ecx=0x00000000 edx=0x00000000
   0x4000000d 0x00: eax=0x00000000 ebx=0x00000000 ecx=0x00000000 edx=0x00000000
   0x4000000e 0x00: eax=0x00000000 ebx=0x00000000 ecx=0x00000000 edx=0x00000000
   0x4000000f 0x00: eax=0x00000000 ebx=0x00000000 ecx=0x00000000 edx=0x00000000
   hypervisor generic timing information (0x40000010):
      TSC frequency (Hz) = 2918402
      bus frequency (Hz) = 66000
   hypervisor_id (0x40000100) = "\0\0\0\0\0\0\0\0\0\0\0\0"
   extended feature flags (0x80000001/edx):
      SYSCALL and SYSRET instructions        = true
      execution disable                      = true
      1-GB large page support                = true
      RDTSCP                                 = true
      64-bit extensions technology available = true
   Intel feature flags (0x80000001/ecx):
      LAHF/SAHF supported in 64-bit mode     = true
      LZCNT advanced bit manipulation        = true
      3DNow! PREFETCH/PREFETCHW instructions = true
   brand = "13th Gen Intel(R) Core(TM) i7-13620H"
   L1 TLB/cache information: 2M/4M pages & L1 TLB (0x80000005/eax):
      instruction # entries     = 0x0 (0)
      instruction associativity = 0x0 (0)
      data # entries            = 0x0 (0)
      data associativity        = 0x0 (0)
   L1 TLB/cache information: 4K pages & L1 TLB (0x80000005/ebx):
      instruction # entries     = 0x0 (0)
      instruction associativity = 0x0 (0)
      data # entries            = 0x0 (0)
      data associativity        = 0x0 (0)
   L1 data cache information (0x80000005/ecx):
      line size (bytes) = 0x0 (0)
      lines per tag     = 0x0 (0)
      associativity     = 0x0 (0)
      size (KB)         = 0x0 (0)
   L1 instruction cache information (0x80000005/edx):
      line size (bytes) = 0x0 (0)
      lines per tag     = 0x0 (0)
      associativity     = 0x0 (0)
      size (KB)         = 0x0 (0)
   L2 TLB/cache information: 2M/4M pages & L2 TLB (0x80000006/eax):
      instruction # entries     = 0x0 (0)
      instruction associativity = L2 off (0)
      data # entries            = 0x0 (0)
      data associativity        = L2 off (0)
   L2 TLB/cache information: 4K pages & L2 TLB (0x80000006/ebx):
      instruction # entries     = 0x0 (0)
      instruction associativity = L2 off (0)
      data # entries            = 0x0 (0)
      data associativity        = L2 off (0)
   L2 unified cache information (0x80000006/ecx):
      line size (bytes) = 0x40 (64)
      lines per tag     = 0x0 (0)
      associativity     = 0x7 (7)
      size (KB)         = 0x500 (1280)
   L3 cache information (0x80000006/edx):
      line size (bytes)     = 0x0 (0)
      lines per tag         = 0x0 (0)
      associativity         = L2 off (0)
      size (in 512KB units) = 0x0 (0)
   RAS Capability (0x80000007/ebx):
      MCA overflow recovery support = false
      SUCCOR support                = false
      HWA: hardware assert support  = false
      scalable MCA support          = false
   Advanced Power Management Features (0x80000007/ecx):
      CmpUnitPwrSampleTimeRatio = 0x0 (0)
   Advanced Power Management Features (0x80000007/edx):
      TS: temperature sensing diode           = false
      FID: frequency ID control               = false
      VID: voltage ID control                 = false
      TTP: thermal trip                       = false
      TM: thermal monitor                     = false
      STC: software thermal control           = false
      100 MHz multiplier control              = false
      hardware P-State control                = false
      TscInvariant                            = true
      CPB: core performance boost             = false
      read-only effective frequency interface = false
      processor feedback interface            = false
      APM power reporting                     = false
      connected standby                       = false
      RAPL: running average power limit       = false
      fast CPPC                               = false
   Physical Address and Linear Address Size (0x80000008/eax):
      maximum physical address bits         = 0x2d (45)
      maximum linear (virtual) address bits = 0x30 (48)
      maximum guest physical address bits   = 0x0 (0)
   Extended Feature Extensions ID (0x80000008/ebx):
      CLZERO instruction                       = false
      instructions retired count support       = false
      always save/restore error pointers       = false
      INVLPGB instruction                      = false
      RDPRU instruction                        = false
      memory bandwidth enforcement             = false
      MCOMMIT instruction                      = false
      WBNOINVD instruction                     = false
      IBPB: indirect branch prediction barrier = false
      interruptible WBINVD, WBNOINVD           = false
      IBRS: indirect branch restr speculation  = false
      STIBP: 1 thr indirect branch predictor   = false
      CPU prefers: IBRS always on              = false
      CPU prefers: STIBP always on             = false
      IBRS preferred over software solution    = false
      IBRS provides same mode protection       = false
      EFER[LMSLE] not supported                = false
      INVLPGB supports TLB flush guest nested  = false
      ppin processor id number supported       = false
      SSBD: speculative store bypass disable   = false
      virtualized SSBD                         = false
      SSBD fixed in hardware                   = false
      CPPC: collaborative processor perf ctrl  = false
      PSFD: predictive store forward disable   = false
      not vulnerable to branch type confusion  = false
      IBPB_RET: ret addr predictor cleared     = false
      branch sampling feature support          = false
      (vuln to branch type confusion synth)    = true
   Size Identifiers (0x80000008/ecx):
      number of CPU cores                 = 0x1 (1)
      ApicIdCoreIdSize                    = 0x0 (0)
      performance time-stamp counter size = 40 bits (0)
   Feature Extended Size (0x80000008/edx):
      max page count for INVLPGB instruction = 0x0 (0)
      RDPRU instruction max input support    = 0x0 (0)
   (instruction supported synth):
      MWAIT = false
   (multi-processing synth) = none
   (multi-processing method) = Intel leaf 0x1f
   (APIC widths synth): CORE_width=0 SMT_width=0
   (APIC synth): PKG_ID=0 CORE_ID=0 SMT_ID=0
   (synth) = Intel Core i*-13000 (Raptor Lake-H/U/P J0)
CPU:
   vendor_id = "GenuineIntel"
   version information (1/eax):
      processor type  = primary processor (0)
      family          = 0x6 (6)
      model           = 0xa (10)
      stepping id     = 0x2 (2)
      extended family = 0x0 (0)
      extended model  = 0xb (11)
      (family synth)  = 0x6 (6)
      (model synth)   = 0xba (186)
   miscellaneous (1/ebx):
      process local APIC physical ID = 0x0 (0)
      maximum IDs for CPUs in pkg    = 0x1 (1)
      CLFLUSH line size              = 0x8 (8)
      brand index                    = 0x0 (0)
   brand id = 0x00 (0): unknown
   feature information (1/edx):
      x87 FPU on chip                        = true
      VME: virtual-8086 mode enhancement     = true
      DE: debugging extensions               = true
      PSE: page size extensions              = true
      TSC: time stamp counter                = true
      RDMSR and WRMSR support                = true
      PAE: physical address extensions       = true
      MCE: machine check exception           = true
      CMPXCHG8B inst.                        = true
      APIC on chip                           = true
      SYSENTER and SYSEXIT                   = true
      MTRR: memory type range registers      = true
      PTE global bit                         = true
      MCA: machine check architecture        = true
      CMOV: conditional move/compare instr   = true
      PAT: page attribute table              = true
      PSE-36: page size extension            = true
      PSN: processor serial number           = false
      CLFLUSH instruction                    = true
      DS: debug store                        = false
      ACPI: thermal monitor and clock ctrl   = false
      MMX Technology                         = true
      FXSAVE/FXRSTOR                         = true
      SSE extensions                         = true
      SSE2 extensions                        = true
      SS: self snoop                         = true
      hyper-threading / multi-core supported = false
      TM: therm. monitor                     = false
      IA64                                   = false
      PBE: pending break event               = false
   feature information (1/ecx):
      PNI/SSE3: Prescott New Instructions     = true
      PCLMULDQ instruction                    = true
      DTES64: 64-bit debug store              = false
      MONITOR/MWAIT                           = false
      CPL-qualified debug store               = false
      VMX: virtual machine extensions         = false
      SMX: safer mode extensions              = false
      Enhanced Intel SpeedStep Technology     = false
      TM2: thermal monitor 2                  = false
      SSSE3 extensions                        = true
      context ID: adaptive or shared L1 data  = false
      SDBG: IA32_DEBUG_INTERFACE              = false
      FMA instruction                         = true
      CMPXCHG16B instruction                  = true
      xTPR disable                            = false
      PDCM: perfmon and debug                 = false
      PCID: process context identifiers       = true
      DCA: direct cache access                = false
      SSE4.1 extensions                       = true
      SSE4.2 extensions                       = true
      x2APIC: extended xAPIC support          = true
      MOVBE instruction                       = true
      POPCNT instruction                      = true
      time stamp counter deadline             = false
      AES instruction                         = true
      XSAVE/XSTOR states                      = true
      OS-enabled XSAVE/XSTOR                  = true
      AVX: advanced vector extensions         = true
      F16C half-precision convert instruction = true
      RDRAND instruction                      = true
      hypervisor guest status                 = true
   cache and TLB information (2):
      0xff: cache data is in CPUID leaf 4
      0xfe: TLB data is in CPUID leaf 0x18
      0xf0: 64 byte prefetching
   processor serial number = 000B-06A2-0000-0000-0000-0000
   deterministic cache parameters (4):
      --- cache 0 ---
      cache type                         = data cache (1)
      cache level                        = 0x1 (1)
      self-initializing cache level      = true
      fully associative cache            = false
      maximum IDs for CPUs sharing cache = 0x0 (0)
      maximum IDs for cores in pkg       = 0x0 (0)
      system coherency line size         = 0x40 (64)
      physical line partitions           = 0x1 (1)
      ways of associativity              = 0xc (12)
      number of sets                     = 0x40 (64)
      WBINVD/INVD acts on lower caches   = false
      inclusive to lower caches          = false
      complex cache indexing             = false
      number of sets (s)                 = 64
      (size synth)                       = 49152 (48 KB)
      --- cache 1 ---
      cache type                         = instruction cache (2)
      cache level                        = 0x1 (1)
      self-initializing cache level      = true
      fully associative cache            = false
      maximum IDs for CPUs sharing cache = 0x0 (0)
      maximum IDs for cores in pkg       = 0x0 (0)
      system coherency line size         = 0x40 (64)
      physical line partitions           = 0x1 (1)
      ways of associativity              = 0x8 (8)
      number of sets                     = 0x40 (64)
      WBINVD/INVD acts on lower caches   = false
      inclusive to lower caches          = false
      complex cache indexing             = false
      number of sets (s)                 = 64
      (size synth)                       = 32768 (32 KB)
      --- cache 2 ---
      cache type                         = unified cache (3)
      cache level                        = 0x2 (2)
      self-initializing cache level      = true
      fully associative cache            = false
      maximum IDs for CPUs sharing cache = 0x0 (0)
      maximum IDs for cores in pkg       = 0x0 (0)
      system coherency line size         = 0x40 (64)
      physical line partitions           = 0x1 (1)
      ways of associativity              = 0xa (10)
      number of sets                     = 0x800 (2048)
      WBINVD/INVD acts on lower caches   = false
      inclusive to lower caches          = false
      complex cache indexing             = false
      number of sets (s)                 = 2048
      (size synth)                       = 1310720 (1.2 MB)
      --- cache 3 ---
      cache type                         = unified cache (3)
      cache level                        = 0x3 (3)
      self-initializing cache level      = true
      fully associative cache            = false
      maximum IDs for CPUs sharing cache = 0x0 (0)
      maximum IDs for cores in pkg       = 0x0 (0)
      system coherency line size         = 0x40 (64)
      physical line partitions           = 0x1 (1)
      ways of associativity              = 0xc (12)
      number of sets                     = 0x8000 (32768)
      WBINVD/INVD acts on lower caches   = false
      inclusive to lower caches          = false
      complex cache indexing             = true
      number of sets (s)                 = 32768
      (size synth)                       = 25165824 (24 MB)
      --- cache 4 ---
      cache type                         = no more caches (0)
   MONITOR/MWAIT (5):
      smallest monitor-line size (bytes)       = 0x0 (0)
      largest monitor-line size (bytes)        = 0x0 (0)
      enum of Monitor-MWAIT exts supported     = false
      supports intrs as break-event for MWAIT  = false
      monitorless MWAIT supported              = false
      number of C0 sub C-states using MWAIT    = 0x0 (0)
      number of C1 sub C-states using MWAIT    = 0x0 (0)
      number of C2 sub C-states using MWAIT    = 0x0 (0)
      number of C3 sub C-states using MWAIT    = 0x0 (0)
      number of C4 sub C-states using MWAIT    = 0x0 (0)
      number of C5 sub C-states using MWAIT    = 0x0 (0)
      number of C6 sub C-states using MWAIT    = 0x0 (0)
      number of C7 sub C-states using MWAIT    = 0x0 (0)
   Thermal and Power Management Features (6):
      digital thermometer                     = false
      Intel Turbo Boost Technology            = false
      ARAT always running APIC timer          = true
      PLN power limit notification            = false
      ECMD extended clock modulation duty     = false
      PTM package thermal management          = false
      HWP base registers                      = false
      HWP notification                        = false
      HWP activity window                     = false
      HWP energy performance preference       = false
      HWP package level request               = false
      HDC base registers                      = false
      Intel Turbo Boost Max Technology 3.0    = false
      HWP capabilities                        = false
      HWP PECI override                       = false
      flexible HWP                            = false
      IA32_HWP_REQUEST MSR fast access mode   = false
      HW_FEEDBACK MSRs supported              = false
      ignoring idle logical processor HWP req = false
      IA32_HWP_CTL MSR supported              = false
      Thread Director                         = false
      IA32_HW_FEEDBACK_THREAD_CONFIG bit 25   = false
      digital thermometer thresholds          = 0x0 (0)
      hardware coordination feedback          = false
      ACNT2 available                         = false
      performance-energy bias capability      = false
      number of enh hardware feedback classes = 0x0 (0)
      performance capability reporting        = false
      energy efficiency capability reporting  = false
      size of feedback struct (4KB pages)     = 0x1 (1)
      index of CPU's row in feedback struct   = 0x0 (0)
   extended feature flags (7):
      FSGSBASE instructions                    = true
      IA32_TSC_ADJUST MSR supported            = true
      SGX: Software Guard Extensions supported = false
      BMI1 instructions                        = true
      HLE hardware lock elision                = false
      AVX2: advanced vector extensions 2       = true
      FDP_EXCPTN_ONLY                          = false
      SMEP supervisor mode exec protection     = true
      BMI2 instructions                        = true
      enhanced REP MOVSB/STOSB                 = true
      INVPCID instruction                      = true
      RTM: restricted transactional memory     = false
      RDT-CMT/PQoS cache monitoring            = false
      deprecated FPU CS/DS                     = true
      MPX: intel memory protection extensions  = false
      RDT-CAT/PQE cache allocation             = false
      AVX512F: AVX-512 foundation instructions = false
      AVX512DQ: double & quadword instructions = false
      RDSEED instruction                       = true
      ADX instructions                         = true
      SMAP: supervisor mode access prevention  = true
      AVX512IFMA: integer fused multiply add   = false
      PCOMMIT instruction                      = false
      CLFLUSHOPT instruction                   = true
      CLWB instruction                         = true
      Intel processor trace                    = false
      AVX512PF: prefetch instructions          = false
      AVX512ER: exponent & reciprocal instrs   = false
      AVX512CD: conflict detection instrs      = false
      SHA instructions                         = true
      AVX512BW: byte & word instructions       = false
      AVX512VL: vector length                  = false
      PREFETCHWT1                              = false
      AVX512VBMI: vector byte manipulation     = false
      UMIP: user-mode instruction prevention   = true
      PKU protection keys for user-mode        = false
      OSPKE CR4.PKE and RDPKRU/WRPKRU          = false
      WAITPKG instructions                     = false
      AVX512_VBMI2: byte VPCOMPRESS, VPEXPAND  = false
      CET_SS: CET shadow stack                 = false
      GFNI: Galois Field New Instructions      = true
      VAES instructions                        = true
      VPCLMULQDQ instruction                   = true
      AVX512_VNNI: neural network instructions = false
      AVX512_BITALG: bit count/shiffle         = false
      TME: Total Memory Encryption             = false
      AVX512: VPOPCNTDQ instruction            = false
      LA57: 57-bit addrs & 5-level paging      = false
      BNDLDX/BNDSTX MAWAU value in 64-bit mode = 0x0 (0)
      RDPID: read processor ID supported       = true
      KL: key locker                           = false
      bus lock detection                       = false
      CLDEMOTE supports cache line demote      = false
      MOVDIRI instruction                      = true
      MOVDIR64B instruction                    = true
      ENQCMD instruction                       = false
      SGX_LC: SGX launch config supported      = false
      PKS: supervisor protection keys          = false
      SGX-KEYS: SGX attestation services       = false
      AVX512_4VNNIW: neural network instrs     = false
      AVX512_4FMAPS: multiply acc single prec  = false
      fast short REP MOV                       = true
      UINTR: user interrupts                   = false
      AVX512_VP2INTERSECT: intersect mask regs = false
      IA32_MCU_OPT_CTRL SRBDS mitigation MSR   = false
      VERW MD_CLEAR microcode support          = true
      RTM transaction always aborts            = false
      IA32_TSX_FORCE_ABORT MSR                 = false
      SERIALIZE instruction                    = true
      hybrid part                              = false
      TSXLDTRK: TSX suspend load addr tracking = false
      PCONFIG instruction                      = false
      LBR: architectural last branch records   = false
      CET_IBT: CET indirect branch tracking    = false
      AMX-BF16: tile bfloat16 support          = false
      AVX512_FP16: fp16 support                = false
      AMX-TILE: tile architecture support      = false
      AMX-INT8: tile 8-bit integer support     = false
      IBRS/IBPB: indirect branch restrictions  = true
      STIBP: 1 thr indirect branch predictor   = true
      L1D_FLUSH: IA32_FLUSH_CMD MSR            = true
      IA32_ARCH_CAPABILITIES MSR               = true
      IA32_CORE_CAPABILITIES MSR               = false
      SSBD: speculative store bypass disable   = true
      SHA512 instructions                      = false
      SM3 instructions                         = false
      SM4 instructions                         = false
      RAO-INT atomic instructions              = false
      AVX-VNNI: AVX VNNI neural network instrs = true
      AVX512_BF16: bfloat16 instructions       = false
      LASS: linear address space separation    = false
      CMPccXADD instructions                   = false
      ArchPerfmonExt leaf 0x23 is valid        = false
      fast zero-length REP MOVSB               = false
      fast short REP STOSB                     = true
      fast short REP CMPSB, REP SCASB          = false
      FRED transitions & MSRs                  = false
      LKGS instruction                         = false
      WRMSRNS instruction                      = false
      NMI-source reporting                     = false
      AMX-FP16: FP16 tile operations           = false
      HRESET: history reset support            = false
      AVX-IFMA: integer fused multiply add     = false
      LAM: linear address masking              = false
      RDMSRLIST, WRMSRLIST instructions        = false
      INVD prevention after BIOS done          = false
      MOVRS instructions                       = false
      IA32_PPIN & IA32_PPIN_CTL MSRs supported = false
      PBNDKB instruction                       = false
      IA32_MISC_ENABLE cannot limit CPUID max  = false
      RDMSR/WRMSRNS immediates supported       = false
      AVX-VNNI-INT8 instructions               = false
      AVX-NE-CONVERT instructions              = false
      AMX-COMPLEX instructions                 = false
      AVX-VNNI-INT16 instructions              = false
      user-timer events                        = false
      PREFETCHIT0, PREFETCHIT1 instructions    = false
      URDMSR, UWRMSR instructions              = false
      UIRET flexibly updates UIF               = false
      CET_SSS: shadow stacks w/o page faults   = false
      AVX10 instructions                       = false
      APX advanced performance extensions      = false
      MWAIT instruction                        = false
      PSFD: fast store forwarding pred disable = true
      IPRED_CTRL: IBP disable                  = false
      RRSBA_CTRL: IBP bottomless RSB disable   = false
      DDPD_U: data dep prefetcher disable      = false
      BHI_CTRL: IBP BHB-focused disable        = false
      MCDT_NO: MCDT mitigation not needed      = false
      UC-lock disable                          = false
      MONITOR perf unaffected by tbl overflow  = false
   Direct Cache Access Parameters (9):
      PLATFORM_DCA_CAP MSR bits = 0
   Architecture Performance Monitoring Features (0xa):
      version ID                               = 0x1 (1)
      number of counters per logical processor = 0x6 (6)
      bit width of counter                     = 0x30 (48)
      length of EBX bit vector                 = 0x7 (7)
      core cycle event                         = not available
      instruction retired event                = not available
      reference cycles event                   = not available
      last-level cache ref event               = not available
      last-level cache miss event              = not available
      branch inst retired event                = not available
      branch mispred retired event             = not available
      topdown slots event                      = not available
      topdown backend bound                    = not available
      topdown bad speculation                  = not available
      topdown frontend bound                   = not available
      topdown retiring                         = not available
      LBR inserts                              = not available
      fixed counter  0 supported               = true
      fixed counter  1 supported               = true
      fixed counter  2 supported               = true
      fixed counter  3 supported               = false
      fixed counter  4 supported               = false
      fixed counter  5 supported               = false
      fixed counter  6 supported               = false
      fixed counter  7 supported               = false
      fixed counter  8 supported               = false
      fixed counter  9 supported               = false
      fixed counter 10 supported               = false
      fixed counter 11 supported               = false
      fixed counter 12 supported               = false
      fixed counter 13 supported               = false
      fixed counter 14 supported               = false
      fixed counter 15 supported               = false
      fixed counter 16 supported               = false
      fixed counter 17 supported               = false
      fixed counter 18 supported               = false
      fixed counter 19 supported               = false
      fixed counter 20 supported               = false
      fixed counter 21 supported               = false
      fixed counter 22 supported               = false
      fixed counter 23 supported               = false
      fixed counter 24 supported               = false
      fixed counter 25 supported               = false
      fixed counter 26 supported               = false
      fixed counter 27 supported               = false
      fixed counter 28 supported               = false
      fixed counter 29 supported               = false
      fixed counter 30 supported               = false
      fixed counter 31 supported               = false
      number of contiguous fixed counters      = 0x0 (0)
      bit width of fixed counters              = 0x0 (0)
      anythread deprecation                    = true
   x2APIC features / processor topology (0xb):
      extended APIC ID                      = 0
      --- level 0 ---
      level number                          = 0x0 (0)
      level type                            = thread (1)
      bit width of level & previous levels  = 0x0 (0)
      number of logical processors at level = 0x1 (1)
      --- level 1 ---
      level number                          = 0x1 (1)
      level type                            = core (2)
      bit width of level & previous levels  = 0x0 (0)
      number of logical processors at level = 0x1 (1)
      --- level 2 ---
      level number                          = 0x2 (2)
      level type                            = invalid (0)
      bit width of level & previous levels  = 0x0 (0)
      number of logical processors at level = 0x0 (0)
   XSAVE features (0xd/0):
      XCR0 valid bit field mask               = 0x0000000000000007
         x87 state                            = true
         SSE state                            = true
         AVX state                            = true
         MPX BNDREGS                          = false
         MPX BNDCSR                           = false
         AVX-512 opmask                       = false
         AVX-512 ZMM_Hi256                    = false
         AVX-512 Hi16_ZMM                     = false
         PKRU state                           = false
         XTILECFG state                       = false
         XTILEDATA state                      = false
      bytes required by fields in XCR0        = 0x00000340 (832)
      bytes required by XSAVE/XRSTOR area     = 0x00000340 (832)
      XSAVEOPT instruction                    = true
      XSAVEC instruction                      = true
      XGETBV instruction                      = true
      XSAVES/XRSTORS instructions             = true
      XFD: extended feature disable supported = false
      SAVE area size in bytes                 = 0x00000340 (832)
      IA32_XSS valid bit field mask           = 0x0000000000000000
         PT state                             = false
         PASID state                          = false
         CET_U user state                     = false
         CET_S supervisor state               = false
         HDC state                            = false
         UINTR state                          = false
         LBR state                            = false
         HWP state                            = false
   AVX/YMM features (0xd/2):
      AVX/YMM save state byte size             = 0x00000100 (256)
      AVX/YMM save state byte offset           = 0x00000240 (576)
      supported in IA32_XSS or XCR0            = XCR0 (user state)
      64-byte alignment in compacted XSAVE     = false
      XFD faulting supported                   = false
   Quality of Service Monitoring Resource Type (0xf/0):
      Maximum range of RMID = 0
      supports L3 cache monitoring = false
   Resource Director Technology Allocation (0x10/0):
      L3 cache allocation technology supported = false
      L2 cache allocation technology supported = false
      memory bandwidth allocation supported    = false
      cache bandwidth allocation supported     = false
   0x00000011 0x00: eax=0x00000000 ebx=0x00000000 ecx=0x00000000 edx=0x00000000
   Software Guard Extensions (SGX) capability (0x12/0):
      SGX1 supported                           = false
      SGX2 supported                           = false
      SGX ENCLV E*VIRTCHILD, ESETCONTEXT       = false
      SGX ENCLS ETRACKC, ERDINFO, ELDBC, ELDUC = false
      SGX ENCLU EVERIFYREPORT2                 = false
      SGX ENCLS EUPDATESVN                     = false
      SGX ENCLU EDECCSSA                       = false
      MISCSELECT.EXINFO supported: #PF & #GP   = false
      MISCSELECT.CPINFO supported: #CP         = false
      MaxEnclaveSize_Not64 (log2)              = 0x0 (0)
      MaxEnclaveSize_64 (log2)                 = 0x0 (0)
   SGX attributes: ECREATE SECS.ATTRIBUTES (0x12/1):
      valid bit mask = 0x00000000000000000000000000000000
      enclave initialized by EINIT           = false
      enclave debugger read/write permission = false
      enclave 64-bit mode                    = false
      provisioning key available             = false
      EINIT token key available              = false
      CET attributes enabled                 = false
      KSS key separation & sharing enabled   = false
      AEX attribute enabled                  = false
      XFRM: XSAVE feature request mask       = 0x0000000000000000
         XCR0 supported: x87 state           = false
         XCR0 supported: SSE state           = false
         XCR0 supported: AVX state           = false
         XCR0 supported: MPX BNDREGS         = false
         XCR0 supported: MPX BNDCSR          = false
         XCR0 supported: AVX-512 opmask      = false
         XCR0 supported: AVX-512 ZMM_Hi256   = false
         XCR0 supported: AVX-512 Hi16_ZMM    = false
         IA32_XSS supported: PT state        = false
         XCR0 supported: PKRU state          = false
         XCR0 supported: CET_U state         = false
         XCR0 supported: CET_S state         = false
         IA32_XSS supported: HDC state       = false
         IA32_XSS supported: UINTR state     = false
         LBR supported                       = false
         IA32_XSS supported: HWP state       = false
         XTILECFG supported                  = false
         XTILEDATA supported                 = false
   SGX Enclave Page Cache (EPC) enumeration (0x12/0x2):
      type = invalid
   0x00000013 0x00: eax=0x00000000 ebx=0x00000000 ecx=0x00000000 edx=0x00000000
   Intel Processor Trace (0x14):
      IA32_RTIT_CR3_MATCH is accessible      = false
      configurable PSB & cycle-accurate      = false
      IP & TraceStop filtering; PT preserve  = false
      MTC timing packet; suppress COFI-based = false
      PTWRITE support                        = false
      power event trace support              = false
      PSB/PMI preservation support           = false
      IA32_RTIT_CTL EventEn enable supported = false
      IA32_RTIT_CTL DisTNT disable supported = false
      PTTT processor trace trigger tracing   = false
      ToPA output scheme support             = false
      ToPA can hold many output entries      = false
      single-range output scheme support     = false
      output to trace transport              = false
      IP payloads have LIP values & CS       = false
   Time Stamp Counter/Core Crystal Clock Information (0x15):
      TSC/clock ratio = 0/0
      nominal core crystal clock = 0 Hz
   Processor Frequency Information (0x16):
      Core Base Frequency (MHz) = 0x0 (0)
      Core Maximum Frequency (MHz) = 0x0 (0)
      Bus (Reference) Frequency (MHz) = 0x0 (0)
   System-On-Chip Vendor Attribute (0x17):
      vendor id     = 0x0 (0)
      vendor scheme = assigned by intel
      project id    = 0x00000000 (0)
      stepping id   = 0x00000000 (0)
   Deterministic Address Translation Parameters (0x18/0):
      4KB page size entries supported   = false
      2MB page size entries supported   = false
      4MB page size entries supported   = false
      1GB page size entries supported   = false
      partitioning                      = soft between logical processors
      ways of associativity             = 0x0 (0)
      number of sets                    = 0x00000000 (0)
      translation cache type            = invalid (0)
      translation cache level           = 0x1 (1)
      fully associative                 = false
      maximum number of addressible IDs = 0x1 (1)
   Key Locker information (0x19):
      CPL0-only restriction supported  = false
      no-encrypt restriction supported = false
      no-decrypt restriction supported = false
      AESKLE: AES instructions         = false
      AES wide instructions            = false
      MSRs & IWKEY backups             = false
      LOADIWKEY NoBackup parameter     = false
      IWKEY randomization supported    = false
   Native Model ID Information (0x1a/0):
      native model ID of core = 0x0 (0)
      core type               = 0x0 (0)
   PCONFIG information (0x1b/0x0):
      sub-leaf type = invalid (0)
   PCONFIG information (0x1b/0x1):
      sub-leaf type = invalid (0)
   Architectural LBR Capabilities (0x1c/0):
      IA32_LBR_DEPTH.DEPTH  8 supported = false
      IA32_LBR_DEPTH.DEPTH 16 supported = false
      IA32_LBR_DEPTH.DEPTH 24 supported = false
      IA32_LBR_DEPTH.DEPTH 32 supported = false
      IA32_LBR_DEPTH.DEPTH 40 supported = false
      IA32_LBR_DEPTH.DEPTH 48 supported = false
      IA32_LBR_DEPTH.DEPTH 56 supported = false
      IA32_LBR_DEPTH.DEPTH 64 supported = false
      deep C-state reset supported      = false
      LBR IP values contain             = EIP (0)
      CPL filtering supported           = false
      branch filtering supported        = false
      call-stack mode supported         = false
      mispredict bit supported          = false
      timed LBRs supported              = false
      branch type field supported       = false
      event logging supported bitmap    = 0x0 (0)
   Tile Information (0x1d):
      max_palette = 0
   TMUL Information (0x1e):
      tmul_maxk                                = 0x0 (0)
      tmul_maxn                                = 0x0 (0)
      AMX-INT8: tile 8-bit integer support     = false
      AMX-BF16: tile bfloat16 support          = false
      AMX-COMPLEX: tile AMX-COMPLEX instrs     = false
      AMX-FP16: tile FP16 support              = false
      AMX-FP8: tile FP8 support                = false
      AMX-TRANSPOSE: tile AMX-TRANSPOSE instrs = false
      AMX-TF32: tile TF32 (FP19) instrs        = false
      AMX-AVX512: tile AMX-AVX512 instrs       = false
      AMX-MOVRS: tile MOVRS instrs             = false
   V2 extended topology (0x1f):
      x2APIC ID of logical processor = 0x0 (0)
      --- level 0 ---
      level number                          = 0x0 (0)
      level type                            = thread (1)
      bit width of level & previous levels  = 0x0 (0)
      number of logical processors at level = 0x1 (1)
      --- level 1 ---
      level number                          = 0x1 (1)
      level type                            = core (2)
      bit width of level & previous levels  = 0x0 (0)
      number of logical processors at level = 0x1 (1)
      --- level 2 ---
      level number                          = 0x2 (2)
      level type                            = invalid (0)
      bit width of level & previous levels  = 0x0 (0)
      number of logical processors at level = 0x0 (0)
   Processor History Reset information (0x20):
      HRESET supported: EHFI history = false
   hypervisor_id (0x40000000) = "VMwareVMware"
   0x40000001 0x00: eax=0x00000000 ebx=0x00000000 ecx=0x00000000 edx=0x00000000
   0x40000002 0x00: eax=0x00000000 ebx=0x00000000 ecx=0x00000000 edx=0x00000000
   0x40000003 0x00: eax=0x00000000 ebx=0x00000000 ecx=0x00000000 edx=0x00000000
   0x40000004 0x00: eax=0x00000000 ebx=0x00000000 ecx=0x00000000 edx=0x00000000
   0x40000005 0x00: eax=0x00000000 ebx=0x00000000 ecx=0x00000000 edx=0x00000000
   0x40000006 0x00: eax=0x00000000 ebx=0x00000000 ecx=0x00000000 edx=0x00000000
   0x40000007 0x00: eax=0x00000000 ebx=0x00000000 ecx=0x00000000 edx=0x00000000
   0x40000008 0x00: eax=0x00000000 ebx=0x00000000 ecx=0x00000000 edx=0x00000000
   0x40000009 0x00: eax=0x00000000 ebx=0x00000000 ecx=0x00000000 edx=0x00000000
   0x4000000a 0x00: eax=0x00000000 ebx=0x00000000 ecx=0x00000000 edx=0x00000000
   0x4000000b 0x00: eax=0x00000000 ebx=0x00000000 ecx=0x00000000 edx=0x00000000
   0x4000000c 0x00: eax=0x00000000 ebx=0x00000000 ecx=0x00000000 edx=0x00000000
   0x4000000d 0x00: eax=0x00000000 ebx=0x00000000 ecx=0x00000000 edx=0x00000000
   0x4000000e 0x00: eax=0x00000000 ebx=0x00000000 ecx=0x00000000 edx=0x00000000
   0x4000000f 0x00: eax=0x00000000 ebx=0x00000000 ecx=0x00000000 edx=0x00000000
   hypervisor generic timing information (0x40000010):
      TSC frequency (Hz) = 2918402
      bus frequency (Hz) = 66000
   hypervisor_id (0x40000100) = "\0\0\0\0\0\0\0\0\0\0\0\0"
   extended feature flags (0x80000001/edx):
      SYSCALL and SYSRET instructions        = true
      execution disable                      = true
      1-GB large page support                = true
      RDTSCP                                 = true
      64-bit extensions technology available = true
   Intel feature flags (0x80000001/ecx):
      LAHF/SAHF supported in 64-bit mode     = true
      LZCNT advanced bit manipulation        = true
      3DNow! PREFETCH/PREFETCHW instructions = true
   brand = "13th Gen Intel(R) Core(TM) i7-13620H"
   L1 TLB/cache information: 2M/4M pages & L1 TLB (0x80000005/eax):
      instruction # entries     = 0x0 (0)
      instruction associativity = 0x0 (0)
      data # entries            = 0x0 (0)
      data associativity        = 0x0 (0)
   L1 TLB/cache information: 4K pages & L1 TLB (0x80000005/ebx):
      instruction # entries     = 0x0 (0)
      instruction associativity = 0x0 (0)
      data # entries            = 0x0 (0)
      data associativity        = 0x0 (0)
   L1 data cache information (0x80000005/ecx):
      line size (bytes) = 0x0 (0)
      lines per tag     = 0x0 (0)
      associativity     = 0x0 (0)
      size (KB)         = 0x0 (0)
   L1 instruction cache information (0x80000005/edx):
      line size (bytes) = 0x0 (0)
      lines per tag     = 0x0 (0)
      associativity     = 0x0 (0)
      size (KB)         = 0x0 (0)
   L2 TLB/cache information: 2M/4M pages & L2 TLB (0x80000006/eax):
      instruction # entries     = 0x0 (0)
      instruction associativity = L2 off (0)
      data # entries            = 0x0 (0)
      data associativity        = L2 off (0)
   L2 TLB/cache information: 4K pages & L2 TLB (0x80000006/ebx):
      instruction # entries     = 0x0 (0)
      instruction associativity = L2 off (0)
      data # entries            = 0x0 (0)
      data associativity        = L2 off (0)
   L2 unified cache information (0x80000006/ecx):
      line size (bytes) = 0x40 (64)
      lines per tag     = 0x0 (0)
      associativity     = 0x7 (7)
      size (KB)         = 0x500 (1280)
   L3 cache information (0x80000006/edx):
      line size (bytes)     = 0x0 (0)
      lines per tag         = 0x0 (0)
      associativity         = L2 off (0)
      size (in 512KB units) = 0x0 (0)
   RAS Capability (0x80000007/ebx):
      MCA overflow recovery support = false
      SUCCOR support                = false
      HWA: hardware assert support  = false
      scalable MCA support          = false
   Advanced Power Management Features (0x80000007/ecx):
      CmpUnitPwrSampleTimeRatio = 0x0 (0)
   Advanced Power Management Features (0x80000007/edx):
      TS: temperature sensing diode           = false
      FID: frequency ID control               = false
      VID: voltage ID control                 = false
      TTP: thermal trip                       = false
      TM: thermal monitor                     = false
      STC: software thermal control           = false
      100 MHz multiplier control              = false
      hardware P-State control                = false
      TscInvariant                            = true
      CPB: core performance boost             = false
      read-only effective frequency interface = false
      processor feedback interface            = false
      APM power reporting                     = false
      connected standby                       = false
      RAPL: running average power limit       = false
      fast CPPC                               = false
   Physical Address and Linear Address Size (0x80000008/eax):
      maximum physical address bits         = 0x2d (45)
      maximum linear (virtual) address bits = 0x30 (48)
      maximum guest physical address bits   = 0x0 (0)
   Extended Feature Extensions ID (0x80000008/ebx):
      CLZERO instruction                       = false
      instructions retired count support       = false
      always save/restore error pointers       = false
      INVLPGB instruction                      = false
      RDPRU instruction                        = false
      memory bandwidth enforcement             = false
      MCOMMIT instruction                      = false
      WBNOINVD instruction                     = false
      IBPB: indirect branch prediction barrier = false
      interruptible WBINVD, WBNOINVD           = false
      IBRS: indirect branch restr speculation  = false
      STIBP: 1 thr indirect branch predictor   = false
      CPU prefers: IBRS always on              = false
      CPU prefers: STIBP always on             = false
      IBRS preferred over software solution    = false
      IBRS provides same mode protection       = false
      EFER[LMSLE] not supported                = false
      INVLPGB supports TLB flush guest nested  = false
      ppin processor id number supported       = false
      SSBD: speculative store bypass disable   = false
      virtualized SSBD                         = false
      SSBD fixed in hardware                   = false
      CPPC: collaborative processor perf ctrl  = false
      PSFD: predictive store forward disable   = false
      not vulnerable to branch type confusion  = false
      IBPB_RET: ret addr predictor cleared     = false
      branch sampling feature support          = false
      (vuln to branch type confusion synth)    = true
   Size Identifiers (0x80000008/ecx):
      number of CPU cores                 = 0x1 (1)
      ApicIdCoreIdSize                    = 0x0 (0)
      performance time-stamp counter size = 40 bits (0)
   Feature Extended Size (0x80000008/edx):
      max page count for INVLPGB instruction = 0x0 (0)
      RDPRU instruction max input support    = 0x0 (0)
   (instruction supported synth):
      MWAIT = false
   (multi-processing synth) = none
   (multi-processing method) = Intel leaf 0x1f
   (APIC widths synth): CORE_width=0 SMT_width=0
   (APIC synth): PKG_ID=0 CORE_ID=0 SMT_ID=0
   (synth) = Intel Core i*-13000 (Raptor Lake-H/U/P J0)
